{
  "schemaVersion": 1,
  "packVersion": "1.0.0",
  "profile": "nextjs",
  "includeCore": false,
  "target": "both",
  "skills": [
    "nextjs-engineering"
  ],
  "createdFiles": [],
  "skillHashes": {
    "codex:nextjs-engineering": "0000000000000000000000000000000000000000000000000000000000000000",
    "claude:nextjs-engineering": "0000000000000000000000000000000000000000000000000000000000000000"
  }
}
